question,chunk,answer,evaluation_factual_correctness_score,evaluation_completeness_score,evaluation_clarity_score,evaluation_comments
"What specific financial highlights or operational changes are mentioned in Oracle Corporation's 2024 fiscal year report, ending on May 31, 2024?","5/25/25, 1:44 PM
10-K
https://www.sec.gov/Archives/edgar/data/1341439/000095017024075605/orcl-20240531.htm
81/194","The information provided does not directly relate to Oracle Corporation's 2024 fiscal year report. However, based on the available data about Oracle Corporation's fiscal 2024 results, here are some key financial highlights and operational changes:

## Financial Highlights
- **Total Revenues**: Oracle's fiscal full-year 2024 total revenues were up 6% in USD and constant currency to $53.0 billion[2].
- **Quarterly Revenues**: In Q4, total quarterly revenues were up 3% year-over-year in USD and up 4% in constant currency to $14.3 billion[3][5].
- **Cloud Services and License Support**: Revenues from cloud services and license support were up 9% in USD and up 10% in constant currency to $10.2 billion[3].
- **Remaining Performance Obligation (RPO)**: RPO increased by 44% to $98 billion, driven by significant sales contracts[2][5].

## Operational Changes
- **Investment in AI and Cloud**: Oracle has been focusing on expanding its cloud services and integrating AI technologies, which contributed to revenue growth[5].
- **Large Language Models**: There was a significant demand for training large language models on Oracle Cloud, driving some of the largest sales contracts in the company's history[2][5].
- **Operational Costs**: The expansion of cloud services increased operational costs, impacting profitability[5].",5,4,5,"The model answer accurately reflects key financial highlights and operational changes for Oracle's fiscal year 2024, consistent with the document and referenced filings. It covers revenue growth, cloud services expansion, and operational costs, which are the main points mentioned. However, it slightly over-attributes specific details (like exact percentages) beyond the direct chunk but supported by referenced filings. Overall, the answer is clear and mostly complete but could include more explicit mention of legal and restructuring aspects noted in the filings."
"Based on the provided chunk of Huy Bui’s professional profile, which details his experience with Publicis Groupe from June 2022 to the present and his recognition in 2024 for innovative analytics solutions, generate the following question:

**What data science initiatives and client-agnostic applications did Huy Bui lead at Publicis Groupe between 2022 and the present, and how did these contribute to increased productivity and innovation at the company, especially noted by the awards received in 2024?**","Huy Bui
williamhuybui@gmail.com | linkedin.com/in/huy-bui-ds
Experience
Publicis Groupe
Remote
Senior Data Scientist
June 2022 – Present
– Developed 7 client-agnostic applications using Python and Dash, empowering 100+ analysts to streamline data
analysis and reporting, saving over 4,600 hours of productivity.
– Led data science initiatives and cross-functional teams to build scalable analytics solutions, driving alignment and
efficiency in a fast-paced, startup-like environment.
– Built an automated data pipeline leveraging Python, SQL, BigQuery, AWS Lambda, S3, and EventBridge.
– Developed regression models and LLM-based procedures to extract insights and optimize marketing spend
allocation for global enterprises.
– Enhanced UI/UX by migrating Python codebases to React, using tools and techniques such as Figma, Postman,
and REST APIs.
Enovate Upstream
Remote
Research Data Scientist
April 2020 – June 2022
– Lead author of the research Machine Learning Applications to Improve Pore Pressure Prediction in Hazardous
Drilling Environments, published at OnePetro.
– Developed time series and physics hybrid-models for drilling measurement predictions, reducing reliance on costly
logging tools and saving clients over $200,000.
– Built a robust data cleaning and standardization pipeline in Python, streamlining data preparation across multiple
clients and reducing manual processing time by 30%.
Texas A&M University
College Station, Texas
Teaching Assistant
August 2017 – May 2019
– Taught Python, Matlab, Calculus I, II, Differential Equations, and Discrete Mathematics to engineering students,
assisting with lectures and grading assessments.
Technical Skills
Data Science and Programming: Python (Pandas, Numpy, Scikit-learn), SQL, JavaScript, React, BigQuery, LLM.
Other: OpenAI api, AWS (S3, Redshift), CI/CD (TeamCity, GitHub).
Education
Texas A&M University
College Station, Texas
Master of Science in Mathematics
July 2019
– Final thesis: Discharging Method on the Planar Graph.
University of Houston - Downtown
Houston, Texas
Bachelor of Science in Mathematics
May 2017
– Summa Cum Laude, minor in Computer Science.
– 4 undergraduate researches in Quantum Calculus.
– President of Math club (3 years), Scholars Academy member, Pi Mu Epsilon member.
Recognition and Activities
1st Place Team - Catalyst Award in Centralized Data | Publicis Groupe - CBS Studio
December 2024
– Recognized for developing a scalable data analytics suite that enhances decision-making and bridges siloed data.
1st Place Team - Publicis Global Data Intelligence Awards | Publicis Groupe
November 2024
– Recognized the most innovative analytics solution across Publicis Groupe.
Mentor | Techsphere
August 2022 - August 2024
– Helped Vietnamese professionals with mock interviews in data science and software engineering.
1st Place Team at Glasstire DataHack | Rice University
December 2019
3rd Place Team at TAMU Hack | Texas A&M University
January 2020","Based on the available information, Huy Bui has been a Data Science Manager at Publicis Groupe since June 2022. His contributions have significantly impacted the development of ROAI, an analytics suite, which has enhanced internal analytics efforts for over 100 analysts and facilitated contracts with global enterprise clients[1]. However, there is no specific information about the recognition he received in 2024 for innovative analytics solutions.

As for the data science initiatives and client-agnostic applications he led, it is known that he contributed to the development of ROAI, which likely involves advanced analytics and data management tools to support business operations and client engagement. These initiatives would have contributed to increased productivity by streamlining analytics processes and improving decision-making capabilities for both internal teams and external clients. However, without more detailed information, it's difficult to specify exactly how these initiatives contributed to innovation at the company or any awards received in 2024.",2,2,4,"The model answer incorrectly states Huy Bui's position as Data Science Manager and mentions development of 'ROAI,' which is not found in the provided document chunk. It also fails to mention key facts from the chunk such as the development of 7 client-agnostic applications, leadership of cross-functional data science initiatives, and explicit recognition from two 2024 awards for innovative analytics solutions at Publicis Groupe. While the answer is mostly clear, it contains inaccuracies and omits significant details relevant to the question about productivity improvements and innovation contribution."
"How does Cisco Systems, Inc. plan to support customers in modernizing their infrastructure during fiscal year 2024, particularly in terms of automation and real-time network management?","Cisco can help customers connect, protect and draw actionable insights from their technology. We do this in service of 
delivering the digital resilience our customers need for today’s complex and unpredictable world.
Customer Priorities
Modernize Infrastructure
In an increasingly digital and connected world, where each new connection to the Internet puts more demand on the network, 
our customers are looking to modernize and transform their infrastructure, including through automation to manage and 
monitor each connection in real time.
We continue to transform our enterprise networking portfolio by bringing together several technologies to form an integrated 
architecture. Our vision is to build a unified management platform experience for on-premise and cloud operating models, that 
simplifies and helps secure networking for customers at scale.
Our Observability offerings collect and process daily measurements from customers’ owned and unowned networks, providing 
automated insights, proactive recommendations, and closed-loop operations tailored to customers to enable them to reduce 
mean time to resolution of issues and improve IT productivity and user experience.
For the data center, our strategy is to deliver multicloud architectures that bring policy and operational consistency, regardless 
of where applications or data reside. We continue to make significant investments in the development of software, silicon and 
optics, which we believe are the building blocks for the internet for the future.
As part of modernizing their infrastructure, customers of every size are also looking for solutions to help them communicate 
more effectively with their customers and to connect their employees more efficiently for productivity. Our collaboration 
portfolio, which includes interoperable devices and our cloud contact center, provides those solutions, and serves as a key 
component of smart buildings, powered over ethernet, that we believe will define the workplaces of the future.
Improve Cybersecurity
With the rapid growth in modern applications, hyper-distributed architecture and increasingly sophisticated cyberattacks, 
customers see cybersecurity as a top priority. Our differentiated security strategy is based on three pillars: moving from point 
solutions to a platform comprehensively integrated with the infrastructure; infusing security into the fabric of the network; and 
harnessing the depth and breadth of telemetry data from Cisco and with our acquisition of Splunk Inc. (“Splunk”) to prevent, 
detect, and respond to sophisticated attacks.
Harness the Power of AI and Data
AI represents a generational shift in technology and is driving an order of magnitude higher requirement for network 
connectivity. We provide network infrastructure to power AI training and inference workloads for both webscalers and 
enterprises. We help to scale our customers’ network infrastructure with high-density routers and switches, improved network 
management, and high-performance optics. We are reinventing data center operations for our customers by simplifying the 
configuration, monitoring, and maintenance of fabrics, compute, networking and storage.
We can help give customers visibility across the network, security solutions, applications and their own business data. With this 
breadth and scale of data, we can help deliver differentiated insights and context to customers, leading them to more informed 
proactive decisions and better business results.
For a discussion of the risks associated with our Strategy and Priorities, see “Item 1A. Risk Factors,” including the risk factor 
entitled “We depend upon the development of new products and services, and enhancements to existing products and services, 
and if we fail to predict and respond to emerging technological trends and customers’ changing needs, our operating results and 
market share may suffer.” For information regarding sales of our major products and services, see Note 19 to the Consolidated 
Financial Statements.
2","Cisco Systems, Inc. is supporting customers in modernizing their infrastructure during fiscal year 2024 by focusing on three core customer priorities: building modern and resilient infrastructure, protecting against cyber threats, and harnessing the power of AI and data. 

To address automation and real-time network management specifically, Cisco is delivering solutions that enable end-to-end infrastructure that is self-monitoring, self-analyzing, and self-optimizing[5]. Their Unified Computing portfolio is designed to increase performance, reduce total cost of ownership (TCO), and simplify management by supporting modern automation, orchestration, management, and analytics tools[5]. This approach allows customers to securely and efficiently provision infrastructure resources while gaining actionable insights from their technology environments.

Cisco’s ongoing innovation is delivered through a combination of hardware, software, and subscription-based services, aligning with flexible consumption models that customers increasingly demand. By providing visibility into data across networks, connected devices, and applications, Cisco enables real-time insights and context for customers, supporting both on-premise and cloud infrastructure. 

Additionally, Cisco is investing in AI-ready data center infrastructure and next-generation modular compute systems, such as the UCS X-Series, to offer more flexibility and choice for customers looking to modernize their compute environments[1][3]. These investments are part of a broader strategy to help customers achieve digital resilience and adapt to the complex, unpredictable demands of today’s technology landscape.",5,5,5,"The answer accurately reflects the document chunk, addressing all key points about automation, real-time management, and Cisco’s investments in AI and infrastructure, while remaining clear and complete."
"What provisions in Netflix, Inc.'s charter documents and Delaware law could discourage a takeover that stockholders might consider favorable as of the fiscal year ended December 31, 2024?","Table of Contents
Risks Related to Our Stock Ownership
Provisions in our charter documents and under Delaware law could discourage a takeover that stockholders may consider favorable, although we
have announced plans to modify some of these provisions over time.
Our charter documents in their current form may discourage, delay or prevent a merger or acquisition that a stockholder may consider favorable because
they:
•
authorize our board of directors, without stockholder approval, to issue up to 10,000,000 shares of undesignated preferred stock;
•
provide for a classified board of directors until our annual meeting of stockholders to be held in 2025;
•
prohibit our stockholders from acting by written consent; and
•
establish advance notice requirements for proposing matters to be approved by stockholders at stockholder meetings.
As a Delaware corporation, we are also subject to certain Delaware anti-takeover provisions. Under Delaware law, a corporation may not engage in a
business combination with any holder of 15% or more of its capital stock unless the holder has held the stock for three years or, among other things, the board
of directors has approved the transaction. Our board of directors could rely on Delaware law to prevent or delay an acquisition of us.
In addition, a merger or acquisition may trigger retention payments to certain executive employees under the terms of our Amended and Restated
Executive Severance and Retention Incentive Plan, thereby increasing the cost of such a transaction.
Our stock price is volatile.
The price at which our common stock has traded has fluctuated significantly. The price may continue to be volatile due to a number of factors including
the following, some of which are beyond our control:
•
variations in our operating results, including our membership acquisition and retention, revenues, operating income, net income, net cash provided by
operating activities and free cash flow;
•
variations between our actual operating results and the expectations of securities analysts, investors and the financial community;
•
announcements of developments affecting our business, systems or expansion plans by us or others;
•
competition, including the introduction of new competitors, their pricing strategies and services;
•
market volatility in general;
•
the level of demand for our stock, including the amount of short interest in our stock;
•
the impact of our current stock repurchase program and any future stock repurchase program we may adopt;
•
the operating results of our competitors; and
•
other risks and uncertainties described in these risk factors.
As a result of these and other factors, investors in our common stock may not be able to resell their shares at or above their original purchase price.
Following certain periods of volatility in the market price of our securities, we became the subject of securities litigation. We may experience more such
litigation following future periods of volatility. This type of litigation may result in substantial costs and a diversion of management’s attention and resources.
Preparing and forecasting our financial results requires us to make judgments and estimates which may differ materially from actual results.
Given the dynamic nature of our business, and the inherent limitations in predicting the future, forecasts of our revenues, operating margins, net income
and other financial and operating data may differ materially from actual results. Also, predicting consumer adoption of various pricing strategies, such as the
ad-supported subscription plan or efforts to limit multi-household usage, and new revenue streams, such as advertising revenue, is inherently difficult given the
lack of operating history with respect to such offerings, and actual results may differ significantly from the expectations of our management, securities analysts
or investors. Such discrepancies could cause a decline in the trading price of our common stock. In addition, the preparation of consolidated financial
statements in conformity with accounting principles generally accepted in the United States of America also requires management to make estimates and
assumptions that affect the reported amounts of assets and liabilities, disclosures of contingent assets and liabilities at the date of the financial statements, and
the reported amounts of revenues and expenses during the reported periods. We base such estimates on historical experience and on various other assumptions
that we believe to be reasonable under the circumstances, but actual results may differ from these estimates. For example, we estimate the content amortization
pattern, beginning with the month of first availability, of any particular licensed or produced television series, documentary or feature film based upon various
factors including historical and estimated viewing patterns. If actual viewing patterns differ from these estimates, the
14","As of the fiscal year ended December 31, 2024, provisions in Netflix, Inc.'s charter documents and Delaware law that could discourage a takeover that stockholders might consider favorable include:

1. **Authorization to Issue Preferred Stock**: Netflix's board of directors can issue up to 10,000,000 shares of undesignated preferred stock without stockholder approval. This can be used to dilute the voting power of common stockholders or to create a class of stock with superior voting rights, potentially discouraging a takeover[1][5].

2. **Classified Board of Directors**: Until the annual meeting of stockholders held in 2025, Netflix's board is classified, meaning directors serve staggered terms. This structure can make it more difficult for an acquirer to gain control of the board quickly[5].

3. **Prohibition on Written Consent**: Stockholders are prohibited from acting by written consent, which can limit their ability to quickly respond to or initiate corporate actions without calling a meeting[5].

4. **Advance Notice Requirements**: Stockholders must provide advance notice for proposing matters to be approved at stockholder meetings, which can delay or complicate the process of initiating a takeover[5].

5. **Delaware Anti-Takeover Provisions**: As a Delaware corporation, Netflix is subject to Delaware law, which includes provisions that can discourage takeovers. For example, a corporation cannot engage in a business combination with a holder of 15% or more of its capital stock unless the holder has held the stock for three years or the board of directors has approved the transaction[5].

6. **Retention Payments**: A merger or acquisition may trigger retention payments to certain executive employees, increasing the cost of such a transaction[5].",5,5,5,"The answer accurately and completely lists all relevant provisions and state law considerations mentioned in the document chunk, presenting them clearly and precisely."
