question,chunk,answer,evaluation_factual_correctness_score,evaluation_completeness_score,evaluation_clarity_score,evaluation_comments
"What criteria did the auditors use to evaluate Alphabet Inc.'s internal control over financial reporting as of December 31, 2024?","REPORT OF INDEPENDENT REGISTERED PUBLIC ACCOUNTING FIRM
To the Stockholders and the Board of Directors of Alphabet Inc.
Opinion on Internal Control Over Financial Reporting
We have audited Alphabet Inc.’s internal control over financial reporting as of December 31, 2024, based on criteria 
established in Internal Control—Integrated Framework issued by the Committee of Sponsoring Organizations of the 
Treadway Commission (2013 framework) (the COSO criteria). In our opinion, Alphabet Inc. (the Company) maintained, 
in all material respects, effective internal control over financial reporting as of December 31, 2024, based on the COSO 
criteria.
We also have audited, in accordance with the standards of the Public Company Accounting Oversight Board (United 
States) (PCAOB), the 2024 consolidated financial statements of the Company and our report dated February 4, 2025 
expressed an unqualified opinion thereon. 
Basis for Opinion
The Company’s management is responsible for maintaining effective internal control over financial reporting and for its 
assessment of the effectiveness of internal control over financial reporting included in the accompanying 
Management’s Report on Internal Control over Financial Reporting. Our responsibility is to express an opinion on the 
Company’s internal control over financial reporting based on our audit. We are a public accounting firm registered with 
the PCAOB and are required to be independent with respect to the Company in accordance with the U.S. federal 
securities laws and the applicable rules and regulations of the Securities and Exchange Commission and the PCAOB.
We conducted our audit in accordance with the standards of the PCAOB. Those standards require that we plan and 
perform the audit to obtain reasonable assurance about whether effective internal control over financial reporting was 
maintained in all material respects.
Our audit included obtaining an understanding of internal control over financial reporting, assessing the risk that a 
material weakness exists, testing and evaluating the design and operating effectiveness of internal control based on 
the assessed risk, and performing such other procedures as we considered necessary in the circumstances. We 
believe that our audit provides a reasonable basis for our opinion.
Definition and Limitations of Internal Control Over Financial Reporting
A company’s internal control over financial reporting is a process designed to provide reasonable assurance regarding 
the reliability of financial reporting and the preparation of financial statements for external purposes in accordance with 
generally accepted accounting principles. A company’s internal control over financial reporting includes those policies 
and procedures that (1) pertain to the maintenance of records that, in reasonable detail, accurately and fairly reflect the 
transactions and dispositions of the assets of the company; (2) provide reasonable assurance that transactions are 
recorded as necessary to permit preparation of financial statements in accordance with generally accepted accounting 
principles, and that receipts and expenditures of the company are being made only in accordance with authorizations 
of management and directors of the company; and (3) provide reasonable assurance regarding prevention or timely 
detection of unauthorized acquisition, use, or disposition of the company’s assets that could have a material effect on 
the financial statements.
Because of its inherent limitations, internal control over financial reporting may not prevent or detect misstatements. 
Also, projections of any evaluation of effectiveness to future periods are subject to the risk that controls may become 
inadequate because of changes in conditions, or that the degree of compliance with the policies or procedures may 
deteriorate.
/s/ Ernst & Young LLP
San Jose, California
February 4, 2025
Table of Contents
Alphabet Inc.
51.","The auditors evaluated Alphabet Inc.’s internal control over financial reporting as of December 31, 2024, using the criteria established in the **Internal Control—Integrated Framework (2013 framework) issued by the Committee of Sponsoring Organizations of the Treadway Commission (COSO)**. This framework is widely recognized as the standard for assessing the effectiveness of internal controls over financial reporting for U.S. public companies[2].

The COSO framework includes five components:  
1. **Control Environment**  
2. **Risk Assessment**  
3. **Control Activities**  
4. **Information and Communication**  
5. **Monitoring Activities**  

Each component is supported by principles that guide the design, implementation, and evaluation of internal controls. The auditors’ opinion was based on whether Alphabet’s internal controls met these COSO criteria in all material respects[2][5].

Additionally, the audit was conducted in accordance with the standards of the **Public Company Accounting Oversight Board (PCAOB)**, which require the auditors to obtain reasonable assurance about the effectiveness of internal control over financial reporting. The audit process included understanding internal controls, assessing the risk of material weaknesses, and testing and evaluating the design and operating effectiveness of controls based on the assessed risk[2].",5,5,5,"The answer accurately identifies the criteria used by the auditors, namely the COSO 2013 Internal Control—Integrated Framework, and clearly explains the five components of the COSO framework. It also correctly notes the audit standards of the PCAOB and the audit procedures performed, fully consistent with the document chunk. The response is detailed, precise, and well-structured for clarity."
"How could changes to legal protections for content moderation and third-party content impact Reddit, Inc.'s potential liability and operational costs for the fiscal year ended December 31, 2024?","Our current protections from liability for content moderation decisions and third-party content posted on our platform in the 
United States could decrease or change, potentially resulting in increased liability for content moderation decisions and third-
party content posted on our platform and higher litigation costs. 
We could also face fines, orders restricting or blocking our services in particular geographies, or other government-
imposed remedies as a result of content hosted on our services. This risk is enhanced in certain jurisdictions outside of the 
United States where our protection from liability for third-party actions may be unclear or where we may be less protected 
under local laws than we are in the United States. Numerous countries in Europe, the Middle East, Asia-Pacific, and Latin 
America are considering or have implemented legislation and regulations imposing potentially significant penalties, including 
fines, service throttling, access bans, or advertising bans, for failure to remove certain types of content or follow certain 
processes. For example, legislation in Germany and India has resulted in the past, and may result in the future, in the imposition 
of fines or other penalties for failure to comply with certain content removal, law enforcement cooperation, and disclosure 
obligations. Content-related legislation and regulations also have required us in the past, and may require us in the future, to 
Table of Contents
34","Changes to legal protections for content moderation and third-party content could significantly impact Reddit, Inc.'s potential liability and operational costs for the fiscal year ended December 31, 2024. 

## Impact on Liability

- Reddit’s current content moderation relies on a multi-layered approach involving community moderators (""mods"") who enforce community-specific rules, alongside Reddit employees (""admins"") who enforce sitewide rules. This decentralized model helps manage content at scale but depends heavily on legal protections that shield platforms from liability for third-party content posted by users[2][3].

- If legal protections for content moderation or immunity for third-party content providers were weakened or removed, Reddit could face increased legal exposure. This would mean Reddit might be held liable for user-generated content that violates laws or regulations, increasing the risk of costly litigation or regulatory penalties[4].

- Such changes could also require Reddit to be more proactive and stringent in content review and removal to mitigate liability, potentially leading to more aggressive moderation policies and increased scrutiny of user content[4].

## Impact on Operational Costs

- Increased liability risks would likely drive up Reddit’s operational costs, as the company would need to invest more in content moderation infrastructure, including hiring more moderators, enhancing automated detection systems, and legal compliance measures[4].

- Reddit already invests in machine learning systems and a combination of automated and manual review to enforce content policies, as reflected in their transparency reports showing increased bans for policy violations[1]. Changes in legal protections could necessitate further scaling of these systems and processes, increasing hosting and operational expenses[4].

- Additionally, Reddit might face higher costs related to legal defenses, settlements, or compliance with new regulatory requirements, which could affect its financial condition and prospects[4].

## Summary

In summary, any changes that reduce legal protections for content moderation and third-party content providers could increase Reddit’s potential liability for user content and substantially raise operational costs related to content moderation and legal compliance during the fiscal year ended December 31, 2024. This would pose risks to Reddit’s business, results of operations, and financial condition[4].",4,4,5,"The model answer accurately captures the key risks Reddit faces if legal protections for content moderation and third-party content change, including increased liability and operational costs, consistent with the document chunk. It reasonably integrates Reddit's moderation approach and potential financial impacts. However, the answer infers some operational details and internal processes not explicitly stated in the chunk but supported by related context from the sources, and it does not explicitly mention geographic-specific risks or government-imposed remedies detailed in the chunk, hence slightly deducting completeness and factual exactness."
How did Tesla's hiring and development programs contribute to its employee growth and retention in 2024?,"Table of Contents
We believe that sound corporate governance is critical to helping us achieve our goals, including with respect to ESG. We
continue to evolve a governance framework that exercises appropriate oversight of responsibilities at all levels throughout the company
and manages its affairs consistent with high principles of business ethics. Our Sustainability and Impact team, in conjunction with
leaders from across our Company, regularly presents to our Board of Directors, which oversees our ESG impacts, initiatives and
priorities.
Human Capital Resources
Tesla’s ability to attract, develop and retain a talented workforce is a competitive advantage. During the past year, Tesla provided
its workforce with opportunities to contribute to its mission and grow professionally, earning Tesla among the Top 100 Employers of
Choice in the 2024 American Opportunity Index. As of December 31, 2024, our employee headcount worldwide was 125,665.
Employees can participate in Tesla stock ownership programs (of which 92% have been given the opportunity to as part of their
total rewards package), while accessing industry-leading benefits, such as free counseling, paid parental leave, paid time off, company
sponsored 401(k) plans, no cost fertility and adoption programs and zero-premium medical plan options that are made available on the
first day of employment.
We hire, evaluate and promote employees based on their skills and performance. In 2024, over 13,000 of our employees
worldwide, 80% of whom represent Tesla’s frontline workforce, took advantage of opportunities to advance their career within the
Company. As of this report, more than two-thirds (68%) of our managers have been promoted from internal, non-managerial positions,
and 45% of our management team has been with Tesla for over five years.
Tesla cultivates an environment that recognizes employee wins and impacts. We enhance everyday recognition by spotlighting
employees and empowering them to recognize each other’s successes. We inform and engage employees to help foster a connected
Tesla experience that supports the business. To enable employee performance, we provide opportunities for them to learn and grow,
including:
Internships & Fellowships
•
Professional Internships – Every year, Tesla hires approximately 4,000 university and community college students globally
for internships across all business groups. We partner with campuses and student organizations to build a high-quality pipeline
of talent, particularly individuals passionate about sustainable energy and autonomy. From day one, our interns contribute to
meaningful projects, often times leading to full-time positions upon completion of their internships.
•
Military Fellowship Program – Tesla's Fellowship program, in partnership with the U.S. Chamber of Commerce
Foundation’s Hire Our Heroes, offers exiting military service members corporate industry experience during their transition in
service. The program aims to convert high-performing individuals to full-time roles and create a veteran talent pipeline for
opportunities across Tesla North America.
Development Programs
•
Manufacturing Development Program – Tesla's global manufacturing pathway programs are designed to provide graduating
high school seniors and early career individuals with the financial resources, coursework and experience they need to start a
successful manufacturing career at Tesla. Through 2024, Tesla expanded the program to new campuses and hired over 800
graduates with a goal for continued growth. In 2025, Tesla plans to hire over 1,000 participants across our factories.
•
Supervisor Professional Program – The Supervisor program is designed for industrial foremen that provides employees the
opportunity to develop expertise in their field. Across a 16-month period, employees take comprehensive coursework in the
fields of technology, law, organization and personnel management. In 2024, our employees became people leaders in the fields
of metal production and electrical technology.
11
5/25/25, 1:46 PM
tsla-20241231
https://www.sec.gov/Archives/edgar/data/1318605/000162828025003063/tsla-20241231.htm
21/157","Tesla’s hiring and development programs in 2024 played a significant role in both employee growth and retention by offering structured pathways for advancement, continuous learning, and meaningful engagement.

## Key Contributions to Employee Growth

- **Internal Promotion and Career Development**
  - Nearly two-thirds (65%) of Tesla’s managers were promoted from internal, non-manager positions, highlighting a strong culture of internal mobility and career progression.
  - The company’s rapid growth (35% over two years) created numerous opportunities for employees to take on new roles and responsibilities, fostering professional development and engagement[1][5].
- **Specialized Training and Certification Programs**
  - **Technician Trainee Program:** Provided on-the-job automotive maintenance training and industry certification, targeting individuals with limited experience. Over 1,900 trainees were hired in 2023 across the U.S., Germany, and China.
  - **START Program:** An intensive, immersive training program for manufacturing and service roles, partnering with colleges and technical academies. Over 350 trainees were hired in 2023, with many transitioning to full-time roles.
  - **Manufacturing Development Program (MDP):** Designed for high school graduates, offering financial resources, coursework, and hands-on experience. Tesla hired 373 graduates in 2023 and aimed to expand to over 600 annually in 2024.
  - **Engineering Development Program:** Launched in 2024 for recent college graduates, focusing on specialized engineering fields and high-demand technologies.
  - **Apprenticeships:** Offered globally, providing academic and on-the-job training for skilled trades, with programs lasting one to four years[1][5].
- **Internships and University Partnerships**
  - Tesla hires over 6,000 university and college students annually from around the world, offering meaningful work and often converting top interns to full-time positions[3][4].
- **Military Fellowship and Transition Programs**
  - These programs support exiting military service members in the U.S. and Europe, providing career guidance and creating a pipeline for veteran talent.

## Key Contributions to Employee Retention

- **Ownership and Benefits**
  - 89% of employees have been given the opportunity to own Tesla stock, fostering a sense of ownership and alignment with company success.
  - Comprehensive benefits include free counseling, paid parental leave, paid time off, and zero-premium medical plan options available from day one.
- **Leadership and Skills Development**
  - Fundamental skills training and continuous development are offered to all leaders globally.
  - Leadership development programs help managers address employee concerns and foster a positive work environment.
- **Inclusive and Respectful Workplace**
  - Tesla’s policies promote fairness, respect, and zero tolerance for harassment or discrimination.
  - Anti-harassment training is mandatory for all new hires and recurring for leaders.
  - Employees are encouraged to speak up about misconduct or safety concerns, with established protocols for investigation and remediation.
- **Employee Educational Assistance Program**
  - Launched in the U.S. in spring 2024, this program supports employees pursuing certificates or degrees, with virtual, self-paced education options.

## Summary Table: Tesla’s Hiring and Development Programs (2024)

| Program/Initiative                | Target Audience                | Key Features                                      | Impact on Growth/Retention         |
|-----------------------------------|-------------------------------|---------------------------------------------------|------------------------------------|
| Technician Trainee Program        | Entry-level, limited experience| On-the-job training, certification                | Skill development, job readiness   |
| START Program                     | College/technical students     | Intensive training, full-time transition           | Talent pipeline, retention         |
| Manufacturing Development Program | High school graduates          | Financial support, coursework, hands-on experience| Career launch, internal mobility   |
| Engineering Development Program   | Recent college graduates       | Specialized engineering training                   | Technical workforce growth         |
| Internships                       | University/college students    | Meaningful work, full-time conversion              | Early talent acquisition           |
| Apprenticeships                   | Skilled trades aspirants       | Academic and on-the-job training                   | Skilled workforce development      |
| Military Fellowship/Transition    | Exiting military personnel     | Career guidance, full-time conversion              | Veteran talent pipeline            |
| Employee Educational Assistance   | All employees                  | Support for certificates/degrees                   | Continuous learning, retention     |

## Conclusion

Tesla’s robust hiring and development programs in 2024 contributed to employee growth by offering clear pathways for advancement, specialized training, and meaningful work experiences. Retention was bolstered by a culture of internal promotion, comprehensive benefits, leadership development, and a strong commitment to an inclusive and respectful workplace. These initiatives collectively positioned Tesla as a desirable employer and supported its continued innovation and expansion[1][5].",2,2,5,"The model answer contains significant factual inaccuracies, such as overstating internal promotion rates (claims 65% vs documented 68%) and includes programs like Technician Trainee, START, and Engineering Development Program which are not mentioned in the source document. It also incorrectly exaggerates employee numbers and growth. The answer is well structured and clearly presented but fails to rely on the provided document chunk, resulting in incomplete coverage of the actual Tesla 2024 hiring and development initiatives and employee retention details."
